{
  "bundle_key": "mindspore.mint.bitwise_and::bitwise_and_tensor_op.yaml",
  "schema_version": "v1",
  "generated_at": "2026-03-31T21:45:05+08:00",
  "identity": {
    "public_api": "mindspore.mint.bitwise_and",
    "public_surface": "mindspore.mint",
    "api_name": "bitwise_and",
    "op_branch": "bitwise_and_tensor_op.yaml",
    "op": "bitwise_and_tensor",
    "primitive": "BitwiseAndTensor"
  },
  "resolver": {
    "py_method": "",
    "interface": "",
    "target_module": "mindspore.ops.function.math_func",
    "target_symbol": "bitwise_and_ext",
    "resolver_kind": "op_def",
    "resolver_path": "mindspore.ops.function.math_func.bitwise_and_tensor_",
    "source_file": "mindspore/python/mindspore/mint/__init__.py"
  },
  "coverage": {
    "coverage_key": "bitwise_and_tensor::BitwiseAndTensor",
    "op_yaml_path": "mindspore/ops/op_def/yaml/bitwise_and_tensor_op.yaml",
    "class_name": "BitwiseAndTensor",
    "dispatch_enable": true,
    "dispatch_kind": "auto_generate",
    "dispatch_ascend": "default",
    "aclnn": [
      "aclnnBitwiseAndTensor"
    ],
    "aclnn_source": [
      "auto_generate_source"
    ],
    "infer": true,
    "pyboost": true,
    "kbk": true,
    "bprop": true,
    "ut": false,
    "st": false,
    "docs_cn": false,
    "docs_en": true
  },
  "evidence": {
    "infer": [
      "mindspore/ops/infer/ops_func_impl/bitwise_and_tensor.cc",
      "mindspore/ops/infer/ops_func_impl/bitwise_and_tensor.h"
    ],
    "pyboost": [
      "mindspore/ops/kernel/ascend/aclnn/pyboost_impl/auto_generate/bitwise_and_tensor.h"
    ],
    "kbk": [
      "mindspore/ops/kernel/ascend/aclnn/kernel_mod_impl/auto_generate/aclnn_kernel_register_auto.cc"
    ],
    "bprop": [
      "mindspore/ccsrc/frontend/expander/grad/grad_math_ops.cc"
    ],
    "ut": [],
    "st": [],
    "docs_cn": [],
    "docs_en": [
      "mindspore/ops/op_def/yaml/doc/bitwise_and_tensor_doc.yaml"
    ]
  },
  "refs": {
    "identity_key": "mindspore.mint.bitwise_and::bitwise_and_tensor_op.yaml",
    "coverage_key": "bitwise_and_tensor::BitwiseAndTensor"
  }
}
