{
  "bundle_key": "mindspore.Tensor.addcdiv::addcdiv_ext_op.yaml",
  "schema_version": "v1",
  "generated_at": "2026-03-31T21:45:05+08:00",
  "identity": {
    "public_api": "mindspore.Tensor.addcdiv",
    "public_surface": "mindspore.Tensor",
    "api_name": "addcdiv",
    "op_branch": "addcdiv_ext_op.yaml",
    "op": "addcdiv_ext",
    "primitive": "AddcdivExt"
  },
  "resolver": {
    "py_method": "tensor_addcdiv_ext",
    "interface": "tensor, function",
    "target_module": "mindspore.ops.api_def",
    "target_symbol": "addcdiv",
    "resolver_kind": "api_def_interface",
    "resolver_path": "mindspore/ops/api_def/addcdiv.yaml",
    "source_file": "mindspore/ops/api_def/addcdiv.yaml"
  },
  "coverage": {
    "coverage_key": "addcdiv_ext::AddcdivExt",
    "op_yaml_path": "mindspore/ops/op_def/yaml/addcdiv_ext_op.yaml",
    "class_name": "AddcdivExt",
    "dispatch_enable": true,
    "dispatch_kind": "auto_generate",
    "dispatch_ascend": "default",
    "aclnn": [
      "aclnnAddcdiv"
    ],
    "aclnn_source": [
      "aclnn_config",
      "auto_generate_source"
    ],
    "infer": true,
    "pyboost": true,
    "kbk": true,
    "bprop": true,
    "ut": true,
    "st": true,
    "docs_cn": false,
    "docs_en": false
  },
  "evidence": {
    "infer": [
      "mindspore/ops/infer/ops_func_impl/addcdiv_ext.cc",
      "mindspore/ops/infer/ops_func_impl/addcdiv_ext.h"
    ],
    "pyboost": [
      "mindspore/ops/kernel/ascend/aclnn/pyboost_impl/auto_generate/addcdiv_ext.h"
    ],
    "kbk": [
      "mindspore/ops/kernel/ascend/aclnn/kernel_mod_impl/aclnn_auto_gen/addcdiv_ext_aclnn_kernel.cc",
      "mindspore/ops/kernel/ascend/aclnn/kernel_mod_impl/aclnn_auto_gen/addcdiv_ext_aclnn_kernel.h"
    ],
    "bprop": [
      "mindspore/ccsrc/frontend/expander/grad/grad_math_ops.cc"
    ],
    "ut": [
      "tests/ut/cpp/ops/test_ops_addcdiv_ext.cc"
    ],
    "st": [
      "tests/st/ops/test_ops_addcdiv_ext.py"
    ],
    "docs_cn": [],
    "docs_en": []
  },
  "refs": {
    "identity_key": "mindspore.Tensor.addcdiv::addcdiv_ext_op.yaml",
    "coverage_key": "addcdiv_ext::AddcdivExt"
  }
}
