{
  "bundle_key": "mindspore.Tensor.index_fill_::inplace_index_fill_tensor_op.yaml",
  "schema_version": "v1",
  "generated_at": "2026-03-31T21:45:05+08:00",
  "identity": {
    "public_api": "mindspore.Tensor.index_fill_",
    "public_surface": "mindspore.Tensor",
    "api_name": "index_fill_",
    "op_branch": "inplace_index_fill_tensor_op.yaml",
    "op": "inplace_index_fill_tensor",
    "primitive": "InplaceIndexFillTensor"
  },
  "resolver": {
    "py_method": "tensor_index_fill_",
    "interface": "tensor",
    "target_module": "mindspore.ops.api_def",
    "target_symbol": "index_fill_",
    "resolver_kind": "api_def_interface",
    "resolver_path": "mindspore/ops/api_def/index_fill_.yaml",
    "source_file": "mindspore/ops/api_def/index_fill_.yaml"
  },
  "coverage": {
    "coverage_key": "inplace_index_fill_tensor::InplaceIndexFillTensor",
    "op_yaml_path": "mindspore/ops/op_def/yaml/inplace_index_fill_tensor_op.yaml",
    "class_name": "InplaceIndexFillTensor",
    "dispatch_enable": true,
    "dispatch_kind": "customize",
    "dispatch_ascend": "InplaceIndexFillTensorAscend",
    "aclnn": [
      "aclnnInplaceIndexFillTensor"
    ],
    "aclnn_source": [
      "customize_source"
    ],
    "infer": true,
    "pyboost": true,
    "kbk": true,
    "bprop": true,
    "ut": false,
    "st": false,
    "docs_cn": false,
    "docs_en": false
  },
  "evidence": {
    "infer": [
      "mindspore/ops/infer/ops_func_impl/inplace_index_fill_tensor.cc",
      "mindspore/ops/infer/ops_func_impl/inplace_index_fill_tensor.h"
    ],
    "pyboost": [
      "mindspore/ops/kernel/ascend/aclnn/pyboost_impl/customize/inplace_index_fill_tensor.cc",
      "mindspore/ops/kernel/ascend/aclnn/pyboost_impl/customize/inplace_index_fill_tensor.h"
    ],
    "kbk": [
      "mindspore/ops/kernel/ascend/aclnn/kernel_mod_impl/customize/inplace_index_fill_tensor_aclnn_kernel.cc",
      "mindspore/ops/kernel/ascend/aclnn/kernel_mod_impl/customize/inplace_index_fill_tensor_aclnn_kernel.h"
    ],
    "bprop": [
      "mindspore/ccsrc/frontend/expander/grad/grad_array_ops.cc"
    ],
    "ut": [],
    "st": [],
    "docs_cn": [],
    "docs_en": []
  },
  "refs": {
    "identity_key": "mindspore.Tensor.index_fill_::inplace_index_fill_tensor_op.yaml",
    "coverage_key": "inplace_index_fill_tensor::InplaceIndexFillTensor"
  }
}
