{
  "bundle_key": "mindspore.ops.lerp::lerp_scalar_op.yaml",
  "schema_version": "v1",
  "generated_at": "2026-03-31T21:45:05+08:00",
  "identity": {
    "public_api": "mindspore.ops.lerp",
    "public_surface": "mindspore.ops",
    "api_name": "lerp",
    "op_branch": "lerp_scalar_op.yaml",
    "op": "lerp_scalar",
    "primitive": "LerpScalar"
  },
  "resolver": {
    "py_method": "tensor_lerp",
    "interface": "tensor, function",
    "target_module": "mindspore.ops.api_def",
    "target_symbol": "lerp",
    "resolver_kind": "api_def_interface",
    "resolver_path": "mindspore/ops/api_def/lerp.yaml",
    "source_file": "mindspore/ops/api_def/lerp.yaml"
  },
  "coverage": {
    "coverage_key": "lerp_scalar::LerpScalar",
    "op_yaml_path": "mindspore/ops/op_def/yaml/lerp_scalar_op.yaml",
    "class_name": "LerpScalar",
    "dispatch_enable": true,
    "dispatch_kind": "customize",
    "dispatch_ascend": "LerpScalarAscend",
    "aclnn": [
      "aclnnLerps"
    ],
    "aclnn_source": [
      "customize_source"
    ],
    "infer": true,
    "pyboost": true,
    "kbk": true,
    "bprop": true,
    "ut": false,
    "st": false,
    "docs_cn": false,
    "docs_en": false
  },
  "evidence": {
    "infer": [
      "mindspore/ops/infer/ops_func_impl/lerp_scalar.cc",
      "mindspore/ops/infer/ops_func_impl/lerp_scalar.h"
    ],
    "pyboost": [
      "mindspore/ops/kernel/ascend/aclnn/pyboost_impl/customize/lerp_scalar.cc",
      "mindspore/ops/kernel/ascend/aclnn/pyboost_impl/customize/lerp_scalar.h"
    ],
    "kbk": [
      "mindspore/ops/kernel/ascend/aclnn/kernel_mod_impl/customize/lerp_scalar_aclnn_kernel.cc",
      "mindspore/ops/kernel/ascend/aclnn/kernel_mod_impl/customize/lerp_scalar_aclnn_kernel.h"
    ],
    "bprop": [
      "mindspore/ccsrc/frontend/expander/grad/grad_math_ops.cc"
    ],
    "ut": [],
    "st": [],
    "docs_cn": [],
    "docs_en": []
  },
  "refs": {
    "identity_key": "mindspore.ops.lerp::lerp_scalar_op.yaml",
    "coverage_key": "lerp_scalar::LerpScalar"
  }
}
