{
  "bundle_key": "mindspore.Tensor.permute::transpose_op.yaml",
  "schema_version": "v1",
  "generated_at": "2026-03-31T21:45:05+08:00",
  "identity": {
    "public_api": "mindspore.Tensor.permute",
    "public_surface": "mindspore.Tensor",
    "api_name": "permute",
    "op_branch": "transpose_op.yaml",
    "op": "transpose",
    "primitive": "Transpose"
  },
  "resolver": {
    "py_method": "deprecated_tensor_permute",
    "interface": "tensor",
    "target_module": "mindspore.ops.api_def",
    "target_symbol": "permute",
    "resolver_kind": "api_def_interface",
    "resolver_path": "mindspore/ops/api_def/permute.yaml",
    "source_file": "mindspore/ops/api_def/permute.yaml"
  },
  "coverage": {
    "coverage_key": "transpose::Transpose",
    "op_yaml_path": "mindspore/ops/op_def/yaml/transpose_op.yaml",
    "class_name": "Transpose",
    "dispatch_enable": true,
    "dispatch_kind": "auto_generate",
    "dispatch_ascend": "default",
    "aclnn": [
      "aclnnPermute"
    ],
    "aclnn_source": [
      "aclnn_config",
      "auto_generate_source"
    ],
    "infer": true,
    "pyboost": false,
    "kbk": true,
    "bprop": true,
    "ut": true,
    "st": true,
    "docs_cn": false,
    "docs_en": true
  },
  "evidence": {
    "infer": [
      "mindspore/ops/infer/ops_func_impl/transpose.cc",
      "mindspore/ops/infer/ops_func_impl/transpose.h",
      "mindspore/ops/infer/symbol_ops_impl/transpose.cc"
    ],
    "pyboost": [],
    "kbk": [
      "mindspore/ops/kernel/ascend/aclnn/kernel_mod_impl/aclnn_auto_gen/transpose_aclnn_kernel.cc",
      "mindspore/ops/kernel/ascend/aclnn/kernel_mod_impl/aclnn_auto_gen/transpose_aclnn_kernel.h"
    ],
    "bprop": [
      "mindspore/ccsrc/frontend/expander/grad/grad_array_ops.cc"
    ],
    "ut": [
      "tests/ut/cpp/ops/test_ops_transpose.cc",
      "tests/ut/cpp/ops/view/test_transpose.cc"
    ],
    "st": [
      "tests/st/ops/cpu/test_transpose_op.py",
      "tests/st/ops/gpu/test_transpose_op.py",
      "tests/st/ops/test_ops_transpose.py"
    ],
    "docs_cn": [],
    "docs_en": [
      "mindspore/ops/op_def/yaml/doc/transpose_doc.yaml"
    ]
  },
  "refs": {
    "identity_key": "mindspore.Tensor.permute::transpose_op.yaml",
    "coverage_key": "transpose::Transpose"
  }
}
