{
  "bundle_key": "mindspore.Tensor.fill_::inplace_fill_scalar_op.yaml",
  "schema_version": "v1",
  "generated_at": "2026-03-31T21:45:05+08:00",
  "identity": {
    "public_api": "mindspore.Tensor.fill_",
    "public_surface": "mindspore.Tensor",
    "api_name": "fill_",
    "op_branch": "inplace_fill_scalar_op.yaml",
    "op": "inplace_fill_scalar",
    "primitive": "InplaceFillScalar"
  },
  "resolver": {
    "py_method": "tensor_inplace_fill_scalar_empty",
    "interface": "tensor",
    "target_module": "mindspore.ops.api_def",
    "target_symbol": "fill_",
    "resolver_kind": "api_def_interface",
    "resolver_path": "mindspore/ops/api_def/fill_.yaml",
    "source_file": "mindspore/ops/api_def/fill_.yaml"
  },
  "coverage": {
    "coverage_key": "inplace_fill_scalar::InplaceFillScalar",
    "op_yaml_path": "mindspore/ops/op_def/yaml/inplace_fill_scalar_op.yaml",
    "class_name": "InplaceFillScalar",
    "dispatch_enable": true,
    "dispatch_kind": "customize",
    "dispatch_ascend": "InplaceFillScalarAscend",
    "aclnn": [
      "aclnnInplaceFillScalar"
    ],
    "aclnn_source": [
      "customize_source"
    ],
    "infer": true,
    "pyboost": true,
    "kbk": true,
    "bprop": true,
    "ut": true,
    "st": false,
    "docs_cn": false,
    "docs_en": false
  },
  "evidence": {
    "infer": [
      "mindspore/ops/infer/ops_func_impl/inplace_fill_scalar.cc",
      "mindspore/ops/infer/ops_func_impl/inplace_fill_scalar.h"
    ],
    "pyboost": [
      "mindspore/ops/kernel/ascend/aclnn/pyboost_impl/customize/inplace_fill_scalar.cc",
      "mindspore/ops/kernel/ascend/aclnn/pyboost_impl/customize/inplace_fill_scalar.h"
    ],
    "kbk": [
      "mindspore/ops/kernel/ascend/aclnn/kernel_mod_impl/customize/inplace_fill_scalar_aclnn_kernel.cc",
      "mindspore/ops/kernel/ascend/aclnn/kernel_mod_impl/customize/inplace_fill_scalar_aclnn_kernel.h"
    ],
    "bprop": [
      "mindspore/ccsrc/frontend/expander/grad/grad_array_ops.cc"
    ],
    "ut": [
      "tests/ut/cpp/ops/test_ops_inplace_fill_scalar.cc"
    ],
    "st": [],
    "docs_cn": [],
    "docs_en": []
  },
  "refs": {
    "identity_key": "mindspore.Tensor.fill_::inplace_fill_scalar_op.yaml",
    "coverage_key": "inplace_fill_scalar::InplaceFillScalar"
  }
}
