{
  "bundle_key": "mindspore.mint.repeat_interleave::repeat_interleave_int_op.yaml",
  "schema_version": "v1",
  "generated_at": "2026-03-31T21:45:05+08:00",
  "identity": {
    "public_api": "mindspore.mint.repeat_interleave",
    "public_surface": "mindspore.mint",
    "api_name": "repeat_interleave",
    "op_branch": "repeat_interleave_int_op.yaml",
    "op": "repeat_interleave_int",
    "primitive": "RepeatInterleaveInt"
  },
  "resolver": {
    "py_method": "tensor_repeat_interleave_ext",
    "interface": "tensor, function",
    "target_module": "mindspore.ops.functional_overload",
    "target_symbol": "repeat_interleave",
    "resolver_kind": "api_def",
    "resolver_path": "mindspore.ops.functional_overload.repeat_interleave",
    "source_file": "mindspore/python/mindspore/mint/__init__.py"
  },
  "coverage": {
    "coverage_key": "repeat_interleave_int::RepeatInterleaveInt",
    "op_yaml_path": "mindspore/ops/op_def/yaml/repeat_interleave_int_op.yaml",
    "class_name": "RepeatInterleaveInt",
    "dispatch_enable": true,
    "dispatch_kind": "customize",
    "dispatch_ascend": "RepeatInterleaveIntAscend",
    "aclnn": [
      "aclnnRepeatInterleaveInt",
      "aclnnRepeatInterleaveIntWithDim"
    ],
    "aclnn_source": [
      "customize_source"
    ],
    "infer": true,
    "pyboost": true,
    "kbk": true,
    "bprop": true,
    "ut": false,
    "st": false,
    "docs_cn": false,
    "docs_en": true
  },
  "evidence": {
    "infer": [
      "mindspore/ops/infer/ops_func_impl/repeat_interleave_int.cc",
      "mindspore/ops/infer/ops_func_impl/repeat_interleave_int.h"
    ],
    "pyboost": [
      "mindspore/ops/kernel/ascend/aclnn/pyboost_impl/customize/repeat_interleave_int.cc",
      "mindspore/ops/kernel/ascend/aclnn/pyboost_impl/customize/repeat_interleave_int.h"
    ],
    "kbk": [
      "mindspore/ops/kernel/ascend/aclnn/kernel_mod_impl/customize/repeat_interleave_int_aclnn_kernel.cc",
      "mindspore/ops/kernel/ascend/aclnn/kernel_mod_impl/customize/repeat_interleave_int_aclnn_kernel.h"
    ],
    "bprop": [
      "mindspore/ccsrc/frontend/expander/grad/grad_array_ops.cc"
    ],
    "ut": [],
    "st": [],
    "docs_cn": [],
    "docs_en": [
      "mindspore/ops/op_def/yaml/doc/repeat_interleave_int_doc.yaml"
    ]
  },
  "refs": {
    "identity_key": "mindspore.mint.repeat_interleave::repeat_interleave_int_op.yaml",
    "coverage_key": "repeat_interleave_int::RepeatInterleaveInt"
  }
}
