{
  "bundle_key": "mindspore.Tensor.floor_divide_::inplace_floor_divide_op.yaml",
  "schema_version": "v1",
  "generated_at": "2026-03-31T21:45:05+08:00",
  "identity": {
    "public_api": "mindspore.Tensor.floor_divide_",
    "public_surface": "mindspore.Tensor",
    "api_name": "floor_divide_",
    "op_branch": "inplace_floor_divide_op.yaml",
    "op": "inplace_floor_divide",
    "primitive": "InplaceFloorDivide"
  },
  "resolver": {
    "py_method": "tensor_floor_divide_",
    "interface": "tensor",
    "target_module": "mindspore.ops.api_def",
    "target_symbol": "floor_divide_",
    "resolver_kind": "api_def_interface",
    "resolver_path": "mindspore/ops/api_def/floor_divide_.yaml",
    "source_file": "mindspore/ops/api_def/floor_divide_.yaml"
  },
  "coverage": {
    "coverage_key": "inplace_floor_divide::InplaceFloorDivide",
    "op_yaml_path": "mindspore/ops/op_def/yaml/inplace_floor_divide_op.yaml",
    "class_name": "InplaceFloorDivide",
    "dispatch_enable": true,
    "dispatch_kind": "customize",
    "dispatch_ascend": "InplaceFloorDivideAscend",
    "aclnn": [
      "aclnnInplaceFloorDivide"
    ],
    "aclnn_source": [
      "customize_source"
    ],
    "infer": true,
    "pyboost": true,
    "kbk": true,
    "bprop": true,
    "ut": true,
    "st": false,
    "docs_cn": false,
    "docs_en": false
  },
  "evidence": {
    "infer": [
      "mindspore/ops/infer/ops_func_impl/inplace_floor_divide.cc",
      "mindspore/ops/infer/ops_func_impl/inplace_floor_divide.h"
    ],
    "pyboost": [
      "mindspore/ops/kernel/ascend/aclnn/pyboost_impl/customize/inplace_floor_divide.cc",
      "mindspore/ops/kernel/ascend/aclnn/pyboost_impl/customize/inplace_floor_divide.h"
    ],
    "kbk": [
      "mindspore/ops/kernel/ascend/aclnn/kernel_mod_impl/customize/inplace_floor_divide_aclnn_kernel.cc",
      "mindspore/ops/kernel/ascend/aclnn/kernel_mod_impl/customize/inplace_floor_divide_aclnn_kernel.h"
    ],
    "bprop": [
      "mindspore/ccsrc/frontend/expander/grad/grad_math_ops.cc"
    ],
    "ut": [
      "tests/ut/cpp/ops/test_ops_inplace_floor_divide.cc"
    ],
    "st": [],
    "docs_cn": [],
    "docs_en": []
  },
  "refs": {
    "identity_key": "mindspore.Tensor.floor_divide_::inplace_floor_divide_op.yaml",
    "coverage_key": "inplace_floor_divide::InplaceFloorDivide"
  }
}
