{
  "bundle_key": "mindspore.Tensor.less::less_op.yaml",
  "schema_version": "v1",
  "generated_at": "2026-03-31T21:45:05+08:00",
  "identity": {
    "public_api": "mindspore.Tensor.less",
    "public_surface": "mindspore.Tensor",
    "api_name": "less",
    "op_branch": "less_op.yaml",
    "op": "less",
    "primitive": "Less"
  },
  "resolver": {
    "py_method": "tensor_less",
    "interface": "tensor, function",
    "target_module": "mindspore.ops.api_def",
    "target_symbol": "less",
    "resolver_kind": "api_def_interface",
    "resolver_path": "mindspore/ops/api_def/less.yaml",
    "source_file": "mindspore/ops/api_def/less.yaml"
  },
  "coverage": {
    "coverage_key": "less::Less",
    "op_yaml_path": "mindspore/ops/op_def/yaml/less_op.yaml",
    "class_name": "Less",
    "dispatch_enable": true,
    "dispatch_kind": "auto_generate",
    "dispatch_ascend": "default",
    "aclnn": [
      "aclnnLtTensor"
    ],
    "aclnn_source": [
      "aclnn_config",
      "auto_generate_source"
    ],
    "infer": true,
    "pyboost": true,
    "kbk": true,
    "bprop": true,
    "ut": true,
    "st": true,
    "docs_cn": false,
    "docs_en": true
  },
  "evidence": {
    "infer": [
      "mindspore/ops/infer/ops_frontend_func_impl/less.cc",
      "mindspore/ops/infer/ops_func_impl/less.cc",
      "mindspore/ops/infer/ops_func_impl/less.h"
    ],
    "pyboost": [
      "mindspore/ops/kernel/ascend/aclnn/pyboost_impl/auto_generate/less.h"
    ],
    "kbk": [
      "mindspore/ops/kernel/ascend/aclnn/kernel_mod_impl/auto_generate/aclnn_kernel_register_auto.cc"
    ],
    "bprop": [
      "mindspore/ccsrc/frontend/expander/grad/grad_math_ops.cc"
    ],
    "ut": [
      "tests/ut/cpp/ops/test_ops_less.cc"
    ],
    "st": [
      "tests/st/ops/ascend/test_tbe_ops/test_less.py",
      "tests/st/ops/cpu/test_less_op.py",
      "tests/st/ops/test_ops_less.py"
    ],
    "docs_cn": [],
    "docs_en": [
      "mindspore/ops/api_def/function_doc/less_doc.yaml",
      "mindspore/ops/op_def/yaml/doc/less_doc.yaml"
    ]
  },
  "refs": {
    "identity_key": "mindspore.Tensor.less::less_op.yaml",
    "coverage_key": "less::Less"
  }
}
