{
  "bundle_key": "mindspore.mint.select::select_ext_view_op.yaml",
  "schema_version": "v1",
  "generated_at": "2026-03-31T21:45:05+08:00",
  "identity": {
    "public_api": "mindspore.mint.select",
    "public_surface": "mindspore.mint",
    "api_name": "select",
    "op_branch": "select_ext_view_op.yaml",
    "op": "select_ext_view",
    "primitive": "SelectExtView"
  },
  "resolver": {
    "py_method": "",
    "interface": "",
    "target_module": "mindspore.ops.auto_generate",
    "target_symbol": "select_ext_view",
    "resolver_kind": "op_def",
    "resolver_path": "mindspore.ops.auto_generate.select_ext_view",
    "source_file": "mindspore/python/mindspore/mint/__init__.py"
  },
  "coverage": {
    "coverage_key": "select_ext_view::SelectExtView",
    "op_yaml_path": "mindspore/ops/op_def/yaml/select_ext_view_op.yaml",
    "class_name": "SelectExtView",
    "dispatch_enable": true,
    "dispatch_kind": "auto_generate",
    "dispatch_ascend": "default",
    "aclnn": [
      "aclnnSelectExtView"
    ],
    "aclnn_source": [
      "default_guess"
    ],
    "infer": true,
    "pyboost": false,
    "kbk": false,
    "bprop": true,
    "ut": false,
    "st": false,
    "docs_cn": false,
    "docs_en": true
  },
  "evidence": {
    "infer": [
      "mindspore/ops/infer/ops_func_impl/select_ext_view.cc",
      "mindspore/ops/infer/ops_func_impl/select_ext_view.h"
    ],
    "pyboost": [],
    "kbk": [],
    "bprop": [
      "mindspore/ccsrc/frontend/expander/grad/grad_array_ops.cc"
    ],
    "ut": [],
    "st": [],
    "docs_cn": [],
    "docs_en": [
      "mindspore/ops/op_def/yaml/doc/select_ext_view_doc.yaml"
    ]
  },
  "refs": {
    "identity_key": "mindspore.mint.select::select_ext_view_op.yaml",
    "coverage_key": "select_ext_view::SelectExtView"
  }
}
