{
  "bundle_key": "mindspore.Tensor.acos::acos_ext_op.yaml",
  "schema_version": "v1",
  "generated_at": "2026-03-31T21:45:05+08:00",
  "identity": {
    "public_api": "mindspore.Tensor.acos",
    "public_surface": "mindspore.Tensor",
    "api_name": "acos",
    "op_branch": "acos_ext_op.yaml",
    "op": "acos_ext",
    "primitive": "AcosExt"
  },
  "resolver": {
    "py_method": "deprecated_tensor_acos",
    "interface": "tensor",
    "target_module": "mindspore.ops.api_def",
    "target_symbol": "acos",
    "resolver_kind": "api_def_interface",
    "resolver_path": "mindspore/ops/api_def/acos.yaml",
    "source_file": "mindspore/ops/api_def/acos.yaml"
  },
  "coverage": {
    "coverage_key": "acos_ext::AcosExt",
    "op_yaml_path": "mindspore/ops/op_def/yaml/acos_ext_op.yaml",
    "class_name": "AcosExt",
    "dispatch_enable": true,
    "dispatch_kind": "auto_generate",
    "dispatch_ascend": "default",
    "aclnn": [
      "aclnnAcos"
    ],
    "aclnn_source": [
      "aclnn_config",
      "auto_generate_source"
    ],
    "infer": true,
    "pyboost": true,
    "kbk": true,
    "bprop": true,
    "ut": true,
    "st": false,
    "docs_cn": false,
    "docs_en": true
  },
  "evidence": {
    "infer": [
      "mindspore/ops/infer/ops_func_impl/acos_ext.cc",
      "mindspore/ops/infer/ops_func_impl/acos_ext.h"
    ],
    "pyboost": [
      "mindspore/ops/kernel/ascend/aclnn/pyboost_impl/auto_generate/acos_ext.h"
    ],
    "kbk": [
      "mindspore/ops/kernel/ascend/aclnn/kernel_mod_impl/auto_generate/aclnn_kernel_register_auto.cc"
    ],
    "bprop": [
      "mindspore/ccsrc/frontend/expander/grad/grad_math_ops.cc"
    ],
    "ut": [
      "tests/ut/cpp/ops/test_ops_acos_ext.cc"
    ],
    "st": [],
    "docs_cn": [],
    "docs_en": [
      "mindspore/ops/op_def/yaml/doc/acos_ext_doc.yaml"
    ]
  },
  "refs": {
    "identity_key": "mindspore.Tensor.acos::acos_ext_op.yaml",
    "coverage_key": "acos_ext::AcosExt"
  }
}
