{
  "bundle_key": "mindspore.Tensor.logical_xor::logical_xor_op.yaml",
  "schema_version": "v1",
  "generated_at": "2026-03-31T21:45:05+08:00",
  "identity": {
    "public_api": "mindspore.Tensor.logical_xor",
    "public_surface": "mindspore.Tensor",
    "api_name": "logical_xor",
    "op_branch": "logical_xor_op.yaml",
    "op": "logical_xor",
    "primitive": "LogicalXor"
  },
  "resolver": {
    "py_method": "tensor_logical_xor",
    "interface": "tensor",
    "target_module": "mindspore.ops.api_def",
    "target_symbol": "logical_xor",
    "resolver_kind": "api_def_interface",
    "resolver_path": "mindspore/ops/api_def/logical_xor.yaml",
    "source_file": "mindspore/ops/api_def/logical_xor.yaml"
  },
  "coverage": {
    "coverage_key": "logical_xor::LogicalXor",
    "op_yaml_path": "mindspore/ops/op_def/yaml/logical_xor_op.yaml",
    "class_name": "LogicalXor",
    "dispatch_enable": true,
    "dispatch_kind": "auto_generate",
    "dispatch_ascend": "default",
    "aclnn": [
      "aclnnLogicalXor"
    ],
    "aclnn_source": [
      "auto_generate_source"
    ],
    "infer": true,
    "pyboost": true,
    "kbk": true,
    "bprop": false,
    "ut": true,
    "st": true,
    "docs_cn": false,
    "docs_en": true
  },
  "evidence": {
    "infer": [
      "mindspore/ops/infer/ops_func_impl/logical_xor.cc",
      "mindspore/ops/infer/ops_func_impl/logical_xor.h"
    ],
    "pyboost": [
      "mindspore/ops/kernel/ascend/aclnn/pyboost_impl/auto_generate/logical_xor.h"
    ],
    "kbk": [
      "mindspore/ops/kernel/ascend/aclnn/kernel_mod_impl/auto_generate/aclnn_kernel_register_auto.cc"
    ],
    "bprop": [],
    "ut": [
      "tests/ut/cpp/ops/test_ops_logical_xor.cc"
    ],
    "st": [
      "tests/st/ops/test_logicalxor.py"
    ],
    "docs_cn": [],
    "docs_en": [
      "mindspore/ops/op_def/yaml/doc/logical_xor_doc.yaml"
    ]
  },
  "refs": {
    "identity_key": "mindspore.Tensor.logical_xor::logical_xor_op.yaml",
    "coverage_key": "logical_xor::LogicalXor"
  }
}
