{
  "bundle_key": "mindspore.ops.min::min_dim_op.yaml",
  "schema_version": "v1",
  "generated_at": "2026-03-31T21:45:05+08:00",
  "identity": {
    "public_api": "mindspore.ops.min",
    "public_surface": "mindspore.ops",
    "api_name": "min",
    "op_branch": "min_dim_op.yaml",
    "op": "min_dim",
    "primitive": "MinDim"
  },
  "resolver": {
    "py_method": "tensor_mindim",
    "interface": "tensor, function",
    "target_module": "mindspore.ops.api_def",
    "target_symbol": "min",
    "resolver_kind": "api_def_interface",
    "resolver_path": "mindspore/ops/api_def/min.yaml",
    "source_file": "mindspore/ops/api_def/min.yaml"
  },
  "coverage": {
    "coverage_key": "min_dim::MinDim",
    "op_yaml_path": "mindspore/ops/op_def/yaml/min_dim_op.yaml",
    "class_name": "MinDim",
    "dispatch_enable": true,
    "dispatch_kind": "auto_generate",
    "dispatch_ascend": "default",
    "aclnn": [
      "aclnnMinDim"
    ],
    "aclnn_source": [
      "auto_generate_source"
    ],
    "infer": true,
    "pyboost": true,
    "kbk": true,
    "bprop": true,
    "ut": false,
    "st": true,
    "docs_cn": false,
    "docs_en": true
  },
  "evidence": {
    "infer": [
      "mindspore/ops/infer/ops_func_impl/min_dim.cc",
      "mindspore/ops/infer/ops_func_impl/min_dim.h"
    ],
    "pyboost": [
      "mindspore/ops/kernel/ascend/aclnn/pyboost_impl/auto_generate/min_dim.h"
    ],
    "kbk": [
      "mindspore/ops/kernel/ascend/aclnn/kernel_mod_impl/aclnn_auto_gen/min_dim_aclnn_kernel.cc",
      "mindspore/ops/kernel/ascend/aclnn/kernel_mod_impl/aclnn_auto_gen/min_dim_aclnn_kernel.h"
    ],
    "bprop": [
      "mindspore/ccsrc/frontend/expander/grad/grad_math_ops.cc"
    ],
    "ut": [],
    "st": [
      "tests/st/ops/test_ops_min_dim.py"
    ],
    "docs_cn": [],
    "docs_en": [
      "mindspore/ops/op_def/yaml/doc/min_dim_doc.yaml"
    ]
  },
  "refs": {
    "identity_key": "mindspore.ops.min::min_dim_op.yaml",
    "coverage_key": "min_dim::MinDim"
  }
}
